{
  "$schema": "./schemas/active-slice.schema.json",
  "status": "active",
  "activeSliceId": "FATES-SLICE-003",
  "baselineCompatibilitySet": "fates-slice-003a-2026-08-10",
  "nextRecommendedSlice": "FATES-SLICE-004",
  "activationRequirements": {
    "acceptedScope": "FATES-SLICE-003A-R1 only: Reproducibility and route-identity remediation covering a tracked/versioned Horae route host, production-style ephemeral Ananke execution-authentication validation, bounded inspection/readiness/action cancellation, bounded producer-result projection, replay-safe application-level request identity, truthful process-correlation versus process-authentication semantics, reproducible real-process acceptance, and additive post-seal qualification of historical 003A. No OS-authenticated process-origin claim, containment, credential broker, provider-network redesign, or 003B work.",
    "ownerOrder": "Integration R1 control activation -> owner-approved R1 implementation task -> tracked Horae route host and bounded relay changes -> production-style Ananke authentication validation -> application-level request identity and projection validation -> component and Integration validation -> reproducible real-process acceptance -> owner review and separate R1 seal/closure decision.",
    "acceptanceCriteria": "R1 eventually requires a tracked Horae server artifact with exact pinned source/build identity; Moirae -> Horae -> canonical Ananke routing; development mode disabled; ephemeral execution authentication supplied out-of-band; secret-free source/log/evidence; bounded peer inspection; exactly one dispatch; no fallback/retry; replay rejection; malformed, wrong-audience, expired, and replayed request rejection before dispatch; allowlisted Ananke result projection; and truthful PID-correlation versus process-authentication evidence. Do not run acceptance during this activation task.",
    "startingCheckpoints": "The sealed fates-slice-003a-2026-08-10 compatibility set is the immutable R1 baseline. fates-lock.json remains sealed/runtime_validated; the compatibility matrix, 003A snapshot, sealed evidence, tags, hashes, and all component checkpoints remain unchanged.",
    "userAuthorisation": "Owner approval in the current task attachment authorizes FATES-SLICE-003A-R1 activation at accepted documentation checkpoint b44194d3273ffa708eaf9c5071fd7f7d6f7adeb1. This task is activation/control-state only; no component implementation or 003B work is authorized here."
  }
}
